id,quote,author,category,tags,source,source_license,search_text
quote-001,A quiet mind can hear the lesson hidden inside a difficult day.,Elias North,philosophy,reflection;resilience;wisdom,Generated synthetic sample data for semantic-search POC,Synthetic sample data; use under this repository's license,"A quiet mind can hear the lesson hidden inside a difficult day. Author: Elias North. Category: philosophy. Tags: reflection, resilience, wisdom."
quote-002,The question that makes us uncomfortable is often the question that makes us grow.,Mara Ellison,philosophy,growth;curiosity;self-examination,Generated synthetic sample data for semantic-search POC,Synthetic sample data; use under this repository's license,"The question that makes us uncomfortable is often the question that makes us grow. Author: Mara Ellison. Category: philosophy. Tags: growth, curiosity, self-examination."
quote-003,Patience is not standing still; it is moving without surrendering to panic.,Jonas Reed,philosophy,patience;calm;discipline,Generated synthetic sample data for semantic-search POC,Synthetic sample data; use under this repository's license,"Patience is not standing still; it is moving without surrendering to panic. Author: Jonas Reed. Category: philosophy. Tags: patience, calm, discipline."
quote-004,Meaning is rarely discovered by accident; it is assembled through attention.,Nadia Vale,philosophy,meaning;attention;purpose,Generated synthetic sample data for semantic-search POC,Synthetic sample data; use under this repository's license,"Meaning is rarely discovered by accident; it is assembled through attention. Author: Nadia Vale. Category: philosophy. Tags: meaning, attention, purpose."
quote-005,The smallest honest choice can redirect the shape of an entire life.,Caleb Rowan,philosophy,integrity;choice;life,Generated synthetic sample data for semantic-search POC,Synthetic sample data; use under this repository's license,"The smallest honest choice can redirect the shape of an entire life. Author: Caleb Rowan. Category: philosophy. Tags: integrity, choice, life."
quote-006,We understand ourselves better when we stop treating every silence as empty.,Iris Camden,philosophy,silence;understanding;self-awareness,Generated synthetic sample data for semantic-search POC,Synthetic sample data; use under this repository's license,"We understand ourselves better when we stop treating every silence as empty. Author: Iris Camden. Category: philosophy. Tags: silence, understanding, self-awareness."
quote-007,A wise person changes direction without pretending the old road was useless.,Theo Marlow,philosophy,change;wisdom;humility,Generated synthetic sample data for semantic-search POC,Synthetic sample data; use under this repository's license,"A wise person changes direction without pretending the old road was useless. Author: Theo Marlow. Category: philosophy. Tags: change, wisdom, humility."
quote-008,Humility begins when certainty leaves enough room for wonder.,Lena Cross,philosophy,humility;wonder;certainty,Generated synthetic sample data for semantic-search POC,Synthetic sample data; use under this repository's license,"Humility begins when certainty leaves enough room for wonder. Author: Lena Cross. Category: philosophy. Tags: humility, wonder, certainty."
quote-009,The truth does not become smaller when we approach it carefully.,Simon Bell,philosophy,truth;care;discernment,Generated synthetic sample data for semantic-search POC,Synthetic sample data; use under this repository's license,"The truth does not become smaller when we approach it carefully. Author: Simon Bell. Category: philosophy. Tags: truth, care, discernment."
quote-010,Every boundary teaches us something about what we value.,Clara Finch,philosophy,boundaries;values;identity,Generated synthetic sample data for semantic-search POC,Synthetic sample data; use under this repository's license,"Every boundary teaches us something about what we value. Author: Clara Finch. Category: philosophy. Tags: boundaries, values, identity."
quote-011,Science begins when wonder learns how to take notes.,Dr. Mira Stone,science,science;wonder;observation,Generated synthetic sample data for semantic-search POC,Synthetic sample data; use under this repository's license,"Science begins when wonder learns how to take notes. Author: Dr. Mira Stone. Category: science. Tags: science, wonder, observation."
quote-012,A good experiment is a question disciplined enough to be tested.,Dr. Nolan Pierce,science,experiments;testing;method,Generated synthetic sample data for semantic-search POC,Synthetic sample data; use under this repository's license,"A good experiment is a question disciplined enough to be tested. Author: Dr. Nolan Pierce. Category: science. Tags: experiments, testing, method."
quote-013,Data does not speak for itself; it waits for careful questions.,Anika Wells,science,data;questions;analysis,Generated synthetic sample data for semantic-search POC,Synthetic sample data; use under this repository's license,"Data does not speak for itself; it waits for careful questions. Author: Anika Wells. Category: science. Tags: data, questions, analysis."
quote-014,"The universe rewards curiosity, but it does not grade on enthusiasm alone.",Dr. Felix Grant,science,curiosity;evidence;universe,Generated synthetic sample data for semantic-search POC,Synthetic sample data; use under this repository's license,"The universe rewards curiosity, but it does not grade on enthusiasm alone. Author: Dr. Felix Grant. Category: science. Tags: curiosity, evidence, universe."
quote-015,A measurement is a promise to be more precise than our first impression.,Rhea Morgan,science,measurement;precision;evidence,Generated synthetic sample data for semantic-search POC,Synthetic sample data; use under this repository's license,"A measurement is a promise to be more precise than our first impression. Author: Rhea Morgan. Category: science. Tags: measurement, precision, evidence."
quote-016,Discovery is what happens when doubt and discipline agree to work together.,Dr. Owen Fields,science,discovery;doubt;discipline,Generated synthetic sample data for semantic-search POC,Synthetic sample data; use under this repository's license,"Discovery is what happens when doubt and discipline agree to work together. Author: Dr. Owen Fields. Category: science. Tags: discovery, doubt, discipline."
quote-017,"Every model is a lantern, not the landscape itself.",Priya Sato,science,models;abstraction;understanding,Generated synthetic sample data for semantic-search POC,Synthetic sample data; use under this repository's license,"Every model is a lantern, not the landscape itself. Author: Priya Sato. Category: science. Tags: models, abstraction, understanding."
quote-018,A theory grows stronger when it survives the questions that were meant to break it.,Dr. Helena Brooks,science,theory;testing;strength,Generated synthetic sample data for semantic-search POC,Synthetic sample data; use under this repository's license,"A theory grows stronger when it survives the questions that were meant to break it. Author: Dr. Helena Brooks. Category: science. Tags: theory, testing, strength."
quote-019,The best tools make complex things visible without pretending they are simple.,Marcus Chen,science,tools;complexity;visibility,Generated synthetic sample data for semantic-search POC,Synthetic sample data; use under this repository's license,"The best tools make complex things visible without pretending they are simple. Author: Marcus Chen. Category: science. Tags: tools, complexity, visibility."
quote-020,Evidence is patience wearing a lab coat.,Dr. Tessa Gray,science,evidence;patience;research,Generated synthetic sample data for semantic-search POC,Synthetic sample data; use under this repository's license,"Evidence is patience wearing a lab coat. Author: Dr. Tessa Gray. Category: science. Tags: evidence, patience, research."
quote-021,A story is a bridge between what happened and what it meant.,Julian West,literature,story;meaning;memory,Generated synthetic sample data for semantic-search POC,Synthetic sample data; use under this repository's license,"A story is a bridge between what happened and what it meant. Author: Julian West. Category: literature. Tags: story, meaning, memory."
quote-022,The right sentence can open a window in a room we thought had no air.,Amelia Hart,literature,writing;language;hope,Generated synthetic sample data for semantic-search POC,Synthetic sample data; use under this repository's license,"The right sentence can open a window in a room we thought had no air. Author: Amelia Hart. Category: literature. Tags: writing, language, hope."
quote-023,Books let us borrow courage from people who never met us.,Rowan Blake,literature,books;courage;empathy,Generated synthetic sample data for semantic-search POC,Synthetic sample data; use under this repository's license,"Books let us borrow courage from people who never met us. Author: Rowan Blake. Category: literature. Tags: books, courage, empathy."
quote-024,A character becomes real when their weakness starts telling the truth.,Elena Frost,literature,characters;truth;weakness,Generated synthetic sample data for semantic-search POC,Synthetic sample data; use under this repository's license,"A character becomes real when their weakness starts telling the truth. Author: Elena Frost. Category: literature. Tags: characters, truth, weakness."
quote-025,Poetry is language walking slowly enough to notice the flowers.,Bennett Cole,literature,poetry;language;attention,Generated synthetic sample data for semantic-search POC,Synthetic sample data; use under this repository's license,"Poetry is language walking slowly enough to notice the flowers. Author: Bennett Cole. Category: literature. Tags: poetry, language, attention."
quote-026,A page can hold an entire storm without spilling a drop.,Cora James,literature,page;emotion;imagination,Generated synthetic sample data for semantic-search POC,Synthetic sample data; use under this repository's license,"A page can hold an entire storm without spilling a drop. Author: Cora James. Category: literature. Tags: page, emotion, imagination."
quote-027,Revision is the art of listening to what the draft tried to say.,Miles Archer,literature,revision;drafting;writing,Generated synthetic sample data for semantic-search POC,Synthetic sample data; use under this repository's license,"Revision is the art of listening to what the draft tried to say. Author: Miles Archer. Category: literature. Tags: revision, drafting, writing."
quote-028,The reader completes the journey the writer only begins.,Sofia Lane,literature,reader;writer;journey,Generated synthetic sample data for semantic-search POC,Synthetic sample data; use under this repository's license,"The reader completes the journey the writer only begins. Author: Sofia Lane. Category: literature. Tags: reader, writer, journey."
quote-029,Fiction tells the truth by changing the names of the doors.,Graham Wilde,literature,fiction;truth;imagination,Generated synthetic sample data for semantic-search POC,Synthetic sample data; use under this repository's license,"Fiction tells the truth by changing the names of the doors. Author: Graham Wilde. Category: literature. Tags: fiction, truth, imagination."
quote-030,A library is a quiet argument against despair.,Nora Quinn,literature,library;hope;knowledge,Generated synthetic sample data for semantic-search POC,Synthetic sample data; use under this repository's license,"A library is a quiet argument against despair. Author: Nora Quinn. Category: literature. Tags: library, hope, knowledge."
quote-031,Leadership is the decision to carry responsibility before carrying authority.,Evan Brooks,leadership,responsibility;authority;leadership,Generated synthetic sample data for semantic-search POC,Synthetic sample data; use under this repository's license,"Leadership is the decision to carry responsibility before carrying authority. Author: Evan Brooks. Category: leadership. Tags: responsibility, authority, leadership."
quote-032,A team trusts a leader who explains the mountain before demanding the climb.,Grace Porter,leadership,teams;trust;clarity,Generated synthetic sample data for semantic-search POC,Synthetic sample data; use under this repository's license,"A team trusts a leader who explains the mountain before demanding the climb. Author: Grace Porter. Category: leadership. Tags: teams, trust, clarity."
quote-033,The strongest leaders make the next decision easier for everyone else.,Nathan Brooks,leadership,decisions;clarity;service,Generated synthetic sample data for semantic-search POC,Synthetic sample data; use under this repository's license,"The strongest leaders make the next decision easier for everyone else. Author: Nathan Brooks. Category: leadership. Tags: decisions, clarity, service."
quote-034,"Influence grows when people feel seen, not managed.",Isabel Hart,leadership,influence;people;empathy,Generated synthetic sample data for semantic-search POC,Synthetic sample data; use under this repository's license,"Influence grows when people feel seen, not managed. Author: Isabel Hart. Category: leadership. Tags: influence, people, empathy."
quote-035,A clear mission turns busy work into forward motion.,Derek Shaw,leadership,mission;focus;execution,Generated synthetic sample data for semantic-search POC,Synthetic sample data; use under this repository's license,"A clear mission turns busy work into forward motion. Author: Derek Shaw. Category: leadership. Tags: mission, focus, execution."
quote-036,The best leaders protect the room where honest feedback can survive.,Leah Bennett,leadership,feedback;trust;culture,Generated synthetic sample data for semantic-search POC,Synthetic sample data; use under this repository's license,"The best leaders protect the room where honest feedback can survive. Author: Leah Bennett. Category: leadership. Tags: feedback, trust, culture."
quote-037,Vision without listening becomes a speech no one follows.,Thomas Vale,leadership,vision;listening;alignment,Generated synthetic sample data for semantic-search POC,Synthetic sample data; use under this repository's license,"Vision without listening becomes a speech no one follows. Author: Thomas Vale. Category: leadership. Tags: vision, listening, alignment."
quote-038,A leader earns speed by first earning alignment.,Monica Reed,leadership,alignment;speed;execution,Generated synthetic sample data for semantic-search POC,Synthetic sample data; use under this repository's license,"A leader earns speed by first earning alignment. Author: Monica Reed. Category: leadership. Tags: alignment, speed, execution."
quote-039,Accountability is not blame; it is ownership with a calendar.,Peter Cross,leadership,accountability;ownership;execution,Generated synthetic sample data for semantic-search POC,Synthetic sample data; use under this repository's license,"Accountability is not blame; it is ownership with a calendar. Author: Peter Cross. Category: leadership. Tags: accountability, ownership, execution."
quote-040,Great teams do not avoid hard conversations; they learn how to survive them.,Megan Stone,leadership,teams;conflict;communication,Generated synthetic sample data for semantic-search POC,Synthetic sample data; use under this repository's license,"Great teams do not avoid hard conversations; they learn how to survive them. Author: Megan Stone. Category: leadership. Tags: teams, conflict, communication."
quote-041,"My calendar has a sense of humor, but it mostly writes tragedies.",Leo Finch,humor,calendar;work;time,Generated synthetic sample data for semantic-search POC,Synthetic sample data; use under this repository's license,"My calendar has a sense of humor, but it mostly writes tragedies. Author: Leo Finch. Category: humor. Tags: calendar, work, time."
quote-042,I cleaned my desk by moving the mystery pile to a more strategic location.,Penny Lane,humor,desk;organization;work,Generated synthetic sample data for semantic-search POC,Synthetic sample data; use under this repository's license,"I cleaned my desk by moving the mystery pile to a more strategic location. Author: Penny Lane. Category: humor. Tags: desk, organization, work."
quote-043,Coffee is proof that beans understand project deadlines.,Maxwell Grant,humor,coffee;deadlines;work,Generated synthetic sample data for semantic-search POC,Synthetic sample data; use under this repository's license,"Coffee is proof that beans understand project deadlines. Author: Maxwell Grant. Category: humor. Tags: coffee, deadlines, work."
quote-044,"I bought a notebook for my plans, and now my plans are to buy more notebooks.",Daisy Moore,humor,notebooks;planning;habits,Generated synthetic sample data for semantic-search POC,Synthetic sample data; use under this repository's license,"I bought a notebook for my plans, and now my plans are to buy more notebooks. Author: Daisy Moore. Category: humor. Tags: notebooks, planning, habits."
quote-045,The printer only jams when it senses confidence.,Harvey Miles,humor,printer;office;technology,Generated synthetic sample data for semantic-search POC,Synthetic sample data; use under this repository's license,"The printer only jams when it senses confidence. Author: Harvey Miles. Category: humor. Tags: printer, office, technology."
quote-046,My password manager knows me better than some relatives do.,Tina Clarke,humor,passwords;technology;identity,Generated synthetic sample data for semantic-search POC,Synthetic sample data; use under this repository's license,"My password manager knows me better than some relatives do. Author: Tina Clarke. Category: humor. Tags: passwords, technology, identity."
quote-047,A quick meeting is any meeting that ends before the snacks become necessary.,Walter Price,humor,meetings;snacks;work,Generated synthetic sample data for semantic-search POC,Synthetic sample data; use under this repository's license,"A quick meeting is any meeting that ends before the snacks become necessary. Author: Walter Price. Category: humor. Tags: meetings, snacks, work."
quote-048,My inbox is not full; it is conducting a stress test.,Olivia Penn,humor,email;stress;work,Generated synthetic sample data for semantic-search POC,Synthetic sample data; use under this repository's license,"My inbox is not full; it is conducting a stress test. Author: Olivia Penn. Category: humor. Tags: email, stress, work."
quote-049,I enjoy multitasking because it lets me be confused in several directions at once.,Frankie Cole,humor,multitasking;confusion;productivity,Generated synthetic sample data for semantic-search POC,Synthetic sample data; use under this repository's license,"I enjoy multitasking because it lets me be confused in several directions at once. Author: Frankie Cole. Category: humor. Tags: multitasking, confusion, productivity."
quote-050,The cloud is just someone else's computer with better marketing.,Riley Banks,humor,cloud;technology;marketing,Generated synthetic sample data for semantic-search POC,Synthetic sample data; use under this repository's license,"The cloud is just someone else's computer with better marketing. Author: Riley Banks. Category: humor. Tags: cloud, technology, marketing."
